{
  "$schema": "https://agpm.dev/schemas/agpm.json",
  "targets": {
    "claude-code": true
  },
  "sources": [
    {
      "name": "anthropics/skills",
      "url": "https://github.com/anthropics/skills.git"
    }
  ],
  "artifacts": [],
  "collections": [
    "anthropics/skills/document-skills"
  ]
}
