{
  "$schema": "https://agpm.dev/schemas/agpm.json",
  "targets": {
    "claude-code": true,
    "opencode": true
  },
  "sources": [
    {
      "name": "anthropics/skills",
      "url": "https://github.com/anthropics/skills.git"
    }
  ],
  "artifacts": [
    "anthropics/skills/pdf"
  ],
  "collections": []
}
